"real_review","real_review_date","real_review_rating","real_user_link","real_user_name"
"Yes, kids, the rumors are true. I needed to do the hula dance to get in. I think I got off relatively light as I saw others having to wear face masks while doing a protracted pantomime. Oh, and as a bonus, all of these are shown inside the bar on CCTV so the patrons can witness the entrants' humiliations. Oh well, I guess that is what alcohol is for. As to the space itself, it is definitely a wander-around-and-look-at-things bar, not just a plant-yourself-on-a-stool bar. The selfie photo booth was a highlight and the decor abounds with a variety of pratfalls. I can see this place staying in business perhaps longer than I otherwise would have estimated, given the influx of tourists and corporate groups (as this location is twinned with the nearby Escape Room). The first time in is definitely an experience just to get the lay of the land/recon. It looks like someone spent quite a bit of time naming the drinks, as the clever names on the menu attest. Since it was happy hour, I went with a well drink (vodka and soda) for $5. I believe happy hour takes place from 4-6 pm with $5 beers and well drinks, and $6 wines. I came in because I wanted to check this place out, and because it was promoted as a tax-day relief special. I can ""safe"" ly say I will probably wait a little while to make a return visit.","4/20/2017","3.0 star rating","https://www.yelp.com/user_details?userid=Y1T7sd4TKOe4utqV5hFdMQ","Shanti N."
"Me and my wife came here a few days ago,and let me tell you the food was great!! The whole spy themed was something we had never experienced before, our server was awesome the service was great,and I loved the fact that we did some clue searching and by the time we were done our food was ready, and I must say our cheese curds and  fish and chips were amazing,they were cooked to perfection. Our server Sparrow her name was, I asked her who made the curds and fish it was delicious,she let us know that agent flip em high had pleasure in making our food,it was delicious!!!! We will be back!","4/27/2017","4.0 star rating","https://www.yelp.com/user_details?userid=A-TErEL9_jQtFz5qZaGFCw","Fred J."
"Easily one of the most unique dining experiences I've ever had. Don't let the red door perceive you, embrace your imagination and walk right in. From the moment you step in, you're captivated by the uniqueness of this place. You're a secret agent embarking on an important mission to fulfill your hunger/thirst needs. Take your time going through the intel, the black ops is dangerously delicious and the fried c4 is explosive. Sterling Archer would be quite proud of this operation. Without a doubt, the most enjoyable experience is making your way over to the magic bar. Whatever misconceptions you may have on the art of magic, let presto enlighten your evening. The mission ahead is important and only the finest agents will complete the task. (English accents are preferred)","3/9/2017","5.0 star rating","https://www.yelp.com/user_details?userid=K3VvB9U1H3KHOoA33ZnUJA","Frank H."
"I like it , friendly service, everything i tried on menu tastes good.  It can get real busy during peak hours although.","4/26/2017","5.0 star rating","https://www.yelp.com/user_details?userid=O0KCdzuoqfjXjkUjj5KfFw","Nick H."
"This is probably one of my favorite new drinking spots in town (allegedly... can't confirm or deny its existence). The staff here make this place go from cool to awesome.  Granted, this is an awesome place if you're looking for fun, delicious drinks and great food; but their staff make it truly memorable. I've never written a yelp review before but Agent Patronus and Agent Raja deserve a huge shout out. They will definitely make a regular out of Agent Alderman!","3/31/2017","5.0 star rating","https://www.yelp.com/user_details?userid=04LDifTUWszukaRajJmAUA","David W."
"This is place is SO cool. What a unique idea and a great change from other bars/lounges. My friends and I had a blast, the service was fantastic, and the food was even better. The burger with the bacon jelly is TO DIE FOR! The cheese curds were also amazing. Fantastic service from Agent Neptune and his killer drinks.","4/22/2017","5.0 star rating","https://www.yelp.com/user_details?userid=ksemAfvC1j71VfRiDB667w","To-uyen V."
"Read the reviews *before* you go to know what you're getting yourself into. (But if you don't, it makes it a strange, unique and unforgettable experience).Decent, standard food and drinkDo not say you're a Russian spy","3/21/2017","4.0 star rating","https://www.yelp.com/user_details?userid=NHpvtnbHbG-Idx3RvbZF0Q","Jennifer F."
"I went to this place for lunch. The whole theme is on point. Everything and everyone - especially the front desk Agent - is in character. It creates a unique atmosphere that adds to its charm. They also give you a ""Recon Duty"", which is a list of missions in scavenger hunt style around the place. It's really fun & the Magician at the bar is amazing. The food is Seriously Good. I had the Double Agent & I have to say, it's probably the best burger I ever had. I heard good things about the C-4, but I didn't try it. I'll definitely come back to try the C-4 & bring my friends to this place.","3/10/2017","5.0 star rating","https://www.yelp.com/user_details?userid=-Gfk0QIHk5PZrEeng8kK2g","Abdul-Aziz A."
"Loved the theme of the place!!! The salmon was great and my friend loved the meatloaf.  Only cons are too many children,  people doing spy hunts while you are trying to eat,  and the cod tacos were not great... it was too heavy, if they had another type of fish... it would've been amazing.  All in all I'd recommend for adults to go later and stay away from the cod tacos.","4/13/2017","4.0 star rating","https://www.yelp.com/user_details?userid=seenndb5qGnayrYEsSNpLg","Tamika P."
"An overall disappointing experience.  Everything took forever to arrive, from the server, to the water, to the food.  When the food finally arrived, it was wrong or overcooked.  After reading such great reviews from other customers, I was expecting a lot more than what we experienced.  The theme was what one would expect and at first it was fun.  By the end of the meal, we were just ready to leave.  I spent 2 hours here that I will not get back.  There are too many other options in River North.  If you are looking for sub-par food with a theme?  Might as well head to Rain Forest Cafe...Hits:  Theme and overall decorationsMisses:  Staff seemed overwhelmed.  Kitchen was out of many items.  Staff seemed confused.  Everything took forever.","3/19/2017","1.0 star rating","https://www.yelp.com/user_details?userid=fTxrjT1UcXAp9SJGQMXgig","Stefan K."
"Awesome concept great drinks. Really cool atmosphere must see inside Bar. Mission accepted.","4/13/2017","5.0 star rating","https://www.yelp.com/user_details?userid=MG8eg-42CmSSVNAhNc8IEA","Andrew K."
"This place is soooo cool!! We had a great time! Food was good, service was excellent. What a hidden gem!! Ps: we didn't know the secret password so we had to dance like monkeys to get in lol.","4/18/2017","5.0 star rating","https://www.yelp.com/user_details?userid=-dKfVOaG0diyAYsVdNM_3Q","Jocelyn T."
"I was very excited to visit SafeHouse after growing up going to the one in Milwaukee, and it did not disappoint! I thought the decor was very well done - lots of little details that give you things to look at long after stepping in and getting your first look at the place. There are many interactive and hidden features that (while of course fun for kids) are fun for adults too! I was expecting a cool ambiance and didn't really expect the food would be much to talk about, but I LOVED the fried chicken sandwich. I would recommend not browsing through too many photos before you go, so you can discover the place on your own.","4/3/2017","5.0 star rating","https://www.yelp.com/user_details?userid=1rWqlFblQBAIWSG7D-A_qw","Lily H."
"You are in for a surprise from finding the location to entering the dining area. Shushhh I can't tell you more .... but the food is fantastic and the drinks on point (bit overpriced). But it is a fun experience and will suggest others to try it too.","4/30/2017","5.0 star rating","https://www.yelp.com/user_details?userid=L4gEZTFeOHgC8lhuRNwSuA","Gaurav B."
"First, if you think you're in for a repeat of the MKE location you're going to be sorely disappointed.  With that said, there is still a lot to like about this place.First, and most notably, the food is EXCELLENT (unlike the MKE location).  The cod was unbelievably good by any standard and both apps were also excellent.Second, the place is pleasantly kitschy, but not in a local joint manner, more in a tourist trap kind of way.  I'd go back for the food, but even though I'm glad I looked around at the memorabilia, I wouldn't go back for that (unlike the MKE location).Third, the service is excellent, but my gosh, give it a rest with calling me Spy and Agent.  More kitsch, but after a while it gets a little annoying.The food is good enough to go back for and I will be doing that, but they should have done more to make the ambiance more realistic.  More old school, less Disneyland.Overall a good experience, but not as good as it could be.  A solid 3-star new addition to Chicago.  It's definitely worth a visit.","3/4/2017","3.0 star rating","https://www.yelp.com/user_details?userid=ICJB4NxY4zCv5B4ak08FoA","Lord Winston C."
"This bar is amazing. One of the most unique bars that I have experienced in Chicago. The staff are awesome and stay in character...from the door guy, to the staff, the the waiters (agent knox is great!) Lots of cool things to see once you finally do get in. The only reason that I am deducting a star, is because after 10:00 you have to pay $5 to get in...just to eat dinner...doesn't make much sense. And and you have to pay $1 to leave  didn't understand that either. And extra $6 on top of dinner, drinks and tipping is a bit much. I'll be back!  But next time before 10:00","3/15/2017","4.0 star rating","https://www.yelp.com/user_details?userid=GJz4tbJb8MVaUtQh7KCXpg","Food C."
"Just looked at the stars on yelp, and went there with wife and three children. Didn't read any of the reviews, because we were in a hurry to feed the savages. Walked past it the first time due to the very clever office sign outside the door. Walked into what appeared to be a law office or some facsimile. Greeted by an attractive lady with an accent, and the story just gets better from there. Very serendipitous. Kids had a blast. The food was awesome. The drinks were awesome. Service was awesome. Great place for adults and children alike. Be sure you bring a $1 bill so you can leave when ready through the secret escape hatch.","4/7/2017","5.0 star rating","https://www.yelp.com/user_details?userid=raWEcJRyJxgvXg7trkx_Rw","David M."
"Great place to visit, especially with kids or tourists.  Gimmicky, obviously, but the food and beer list are pretty good.  Service isn't quite where they want it to be yet, but they haven't been open very long and it's not a typical server job.  The hostess downstairs didn't seem to understand the concept.  Agent Wizard was excellent, however.","4/4/2017","4.0 star rating","https://www.yelp.com/user_details?userid=_E5HgOQAMmqoEaADj1wDeA","maurice s."
"Wow! This bar takes the James Bond and spy themed to a whole new level... As they say the devil's on the details and allot of little details are put into the décor, mysteries, and puzzles are loaded into everything. From the car still that waitress and lowers to the Daniel Craig sorry bird test on the ladies room. I think half the fun in this place is that it's all A HUGE secret. The main bar was busy, and the host said they had a magician at the back bar, so we decided to head there.Without giving too much away about this iconic bar- we sat at the back bar, the gadget bar and had a blast! Our bartender Xavier was also an amazing magician. He read my mind and bent a fork in my friends have. He was hilarious and had the crowd in stitches.The bartender/magician suggested the cheese curds and meatloaf. I'm not a meatloaf fan but he was definitely right, everything was tasty and fresh. We were told that the cheese came fresh from Wisconsin and that the meat loaf was a mix of 2 different meats. The old fashioned was great too! I can't recommend this place highly enough!","3/17/2017","5.0 star rating","https://www.yelp.com/user_details?userid=TnCACX1N74alMeBOymqZTg","Kevin S."
"OK, this place is pretty cool.  We came here after eating dinner somewhere else.  I have to give a shout out to the front desk girl/receptionist.  One person in our party was super drunk and acting like a fool.  She remained in character and polite, so kudos to her.  Since we didn't have the password, they made us do some funny group thing to get in.  Drinks were strong and fantastic.  Decor, ambience, vibe were all in line with the amazing things I've heard of.  The photobooth was big enough to squeeze in 10 people.  They had a lot of interactive ""spy tech"" playthings sprinkled throughout the basement bar.  Special shout out to Gabriel.  I believe he's the GM, super nice guy.  The one downside...couldn't figure out the password that we were supposed to figure out by piecing together hidden hints in the paintings/walls/decor etc.","3/6/2017","4.0 star rating","https://www.yelp.com/user_details?userid=pw0GYk68mvBJI80jq6YO8g","Al M."
"I loved every second of being inside the safe house. It's more the just a cool bar or restaurant, it's an experience! So much time and detail went into creating this awesome establishment. Our server (agent lostgirl) was great! She went above and beyond to craft the experience. She had backstory and a reason for her name. Saying I will be back would e a severe understatement. Oh and I can't forget agent smooth for keeping us laughing and being great overall!","3/19/2017","5.0 star rating","https://www.yelp.com/user_details?userid=_B2e6A1seLQtY4P4bPEXtQ","Rashad W."
"This is a very unique(at least to me) bar/restaurant! We were directed here by chance and where extremely surprised from the get-go and I will leave it at that. To top it off the food was great. We had the dry rub wings and the mac and cheese.This bar is a must see and is great for all ages.Also, for the husband/wife looking for something fun to treat their significant with, they offer something special for you.","3/12/2017","5.0 star rating","https://www.yelp.com/user_details?userid=20klmMwuz3BKD44tU5mr4Q","Marcell P."
"The service was outstanding! The drinks were delicious and the environment was so much fun. I highly recommend.","4/13/2017","5.0 star rating","https://www.yelp.com/user_details?userid=Sl-bYSD-W3l8REgj8ujOKw","Kelsey B."
"Super great affordable evening for families with kids! Went and had a great time- particularly our seven-year-old who was mesmerized by all there was to do. My wife and I also found the spy theme and decor fun and well- done. My burger was yummy but my wife did not care for the Colombian salad which was swimming in dressing.","4/10/2017","5.0 star rating","https://www.yelp.com/user_details?userid=Lnp69xb5vLu4Zwb83uOZzg","David R."
"I had been to the original one in Milwaukee and was excited to see that it was coming to Chicago. It was everything I hoped and more!! I've already been twice and all the friends I brought LOVED it.","4/7/2017","5.0 star rating","https://www.yelp.com/user_details?userid=NBXko5inimHe1A8blhLo6A","Arden J."
"I would give you the password to this place but I don't know it. May be difficult to find, but don't give up!!!!!  Or they will find you. ;)  once you get through, you will encounter a friendly staff. The drinks are amazing!  We had the poutine and it was decent. Drinks are bomb. What's even better is going through a mission. Press all the buttons you want. And don't be afraid to take pictures!!!!  This is a must place to visit.","4/5/2017","5.0 star rating","https://www.yelp.com/user_details?userid=xMGG9gnKUpr8aAjSG6R2XA","Tracy D."
"All you need to know is the password is not yelling, ""ROCK 'N ROLL MCDONALDS!!"" Nor is it ""Grimace"" nor ""Cheeseburger"" my friend saved me from certain torture and death with her cunningness and intelligence.","4/12/2017","4.0 star rating","https://www.yelp.com/user_details?userid=uhPmesSpP2SXKwtcUBqaHA","Tommy J."
"Freakin' awesome! I love themed places like this, especially the spy theme. There are so many artifacts and memorabilia in this place to geek out on. I really wish there were more themed bars such as this place around my area. If you're visiting Chicago I recommend visiting this place if you can. Tip: it's a little hard to find.","4/10/2017","5.0 star rating","https://www.yelp.com/user_details?userid=Gz9a3qrjOqjb4qfYRoHc7g","Norman L."
"Where to begin...came here after the escape room. Our party of 8 was seated for lunch at 1:30. Waited 20 mins to get water. Finally ordered and one of our party was informed that they ran out of the salad she ordered. She then opted for the fried chicken sandwich...they were also out of chicken. I mean c'mon. Food finally arrives and missing items galore. Forgot onion rings. Forgot chicken on the salad. Forgot dressings. Then the bill came. We opted to split 4 ways and then realized we were all overcharged. They continued the ""spy"" gimmick all throughout our infuriating experience. Learn when to drop the act and focus on service. Hope to God the location in Milwaukee is much better.","3/19/2017","1.0 star rating","https://www.yelp.com/user_details?userid=V0Xp2Mw7Vqpt2t8Do8uTgw","Joe D."
"I love this place, the people who work there really make it. I had the cheese curds and the prime rib timed drop and it was amazing. Ask for Diva Davine, she is awesome.","4/8/2017","5.0 star rating","https://www.yelp.com/user_details?userid=9twJY23Qx0hK0YnrDpzuKQ","Antonio A."
"This place is a joke! I Open the door and and lady was at an office desk. She asked me what I know??? I have know idea what the hell she was talking about. I thought that I had the wrong place. I asked her if this was the safe house restaurant and she said yes and asked me what I know I know again. All I know is that I was hungry and didn't want to play any games. My party and I turned around and left.","3/20/2017","1.0 star rating","https://www.yelp.com/user_details?userid=YVffcXS-2rYz4jw91xZZoA","Tony S."
"If you think you're in the wrong place, you're in the right place. The sillier you are at the door the faster they let you in so be prepared to ham it up! Food is okay, not bad, but nothing spectacular. Atmosphere is kick ass and the staff is great!","4/4/2017","5.0 star rating","https://www.yelp.com/user_details?userid=aMnhS4o0gp-MmWHqeylC4Q","Kayla H."
"heard about this through a news article and it peaked my interest. My girlfriend and I needed a place to the spend a fun Saturday night and she was okay with going here even though neither of us knew what to expect. It can be confusing getting in there and the admittance procedure is a lot of fun. We already ate so we just got a drink and appetizer which  were both good. The place is a little overpriced but you're kind of paying for the Ambiance. All the activities that they give you on a check list are fun albeit they're over pretty quickly once you know what you're doing. There are a lot of other things you could do in there that aren't on the checklist, some of which actually require some skills to figure out. I wonder if there are even deeper puzzles or everything I've done is all there is. I don't know about how this place would fare on multiple visits but I would at least go here one more time with people that haven't, just to see their reactions. If you have some money some friends and are wanting to have a very entertaining night with Intrigue, I recommend this place.","3/21/2017","5.0 star rating","https://www.yelp.com/user_details?userid=JhfZjEKPkh7oZKkzUEbSRA","Derek P."
"This place is crazy (in the best possible way)!   The experience alone is worth the trip, but the food is great too.  Only place I've ever been where the burger with everything including a sunny side up egg didn't fall apart.  Awesome bun!  People are also super. On top of everything else, I had a problem with my bill (my fault) and they were already fixing it when I called the next day.  Can't say enough good things about this place....that's not actually there. ;)","4/15/2017","5.0 star rating","https://www.yelp.com/user_details?userid=FHP7WxVfJ7hPkY4MabUhew","Steve C."
"I'm usually not a gimmicky person, but the atmosphere was fun and the food was good/well portioned. Great servers as well!","3/16/2017","5.0 star rating","https://www.yelp.com/user_details?userid=KgCfarfh1WHUYRyP7pnPlA","Eric W."
"First time going there had a blast. Food was great and so was the service. Agent Xavier was AMAZING. Everyone needs go and visit this place.","3/26/2017","5.0 star rating","https://www.yelp.com/user_details?userid=NAtkjA-5LE8VaCklKH_E3g","Roxanne F."
"My family and I went here last night to celebrate a birthday. It was the most uniquely wonderful experience. We had a great waiter named Tiny who was beyond delightful and fully in character. When you get seated there are fun little spy missions to do throughout the restaurant and bar area. I highly recommend going, and ask for Tiny!","4/1/2017","5.0 star rating","https://www.yelp.com/user_details?userid=V-dP3clCjVhUq_4n0ftzyQ","Jen K."
"Agent raja kept us entertained through out the night. Highly recommend a bar seat if he's working. Hard to find with several people walking by it at first. With the escape rooms nearby we didn't know if it's a continuation of that or the right place. Food was good. We both had the black bird chicken sandwich. Could have used a touch more salt for me. Fries were average but at least executed well. Onion rings are worth the upgrade. Still don't know the password so I'll have to prove my worthiness again next time.","3/19/2017","4.0 star rating","https://www.yelp.com/user_details?userid=K4G4TnuWy9Br9u2sA4-zWA","arjun r."
"5 star rating for atmosphere, 1 star rating for the food, leading to my average rating being 3 stars.  My boyfriend surprised me with SafeHouse.  Being a HUGE fan of James Bond, I appreciated a lot of the various memrobilia placed throughout the entire restaurant/bar.  Hell, they even had a photo of Walter Gotell who played General Gogol in the James Bond series (yes I'm really a Bond fan).  The decor, and memrobilia was spot on.  Exiting was a bit tricky, and I wound up swiping my car through the reader, later noticing there being a $1 pending charge on my debit card.  If I do get charged, I will be irritated, but not going to cry about it.  Every employee plays their part well, and although our waiter was a little too much into it, fast talking, and annoying, he did his job very well.The food was just not good for what you pay.  It is expensive.  I ordered the meatloaf with mashed potatoes, and my boyfriend ordered the fish n chips.  Our server recommended the cheese curds, which were surprisingly fantastic.  I even ordered a second while waiting for our food.  The meatloaf was cold, and tasted like straight italian sausage meat held together with breadcrumbs and pieces of green pepper.  There was also no other flavor or seasoning associated with it.  The mashed potatoes were not special; no buttery taste or seasoned with herbs.  The mushroom sauce covering the loaf and mashed potatoes was incredibly salty and heavy.  I tried the fried fish, which was bland, cold, and over fried.  Good fried fish is served literally out of the frier.Ultimately, I would return and try the burgers, as there seems to be a common thumbs up for those in the reviews here, but I don't really think of this place being a restaurant.  It's more so a really cool bar.  I'll give it some time, but will be back.  This is a great place to bring friends, and family when they're visiting the area.","3/13/2017","3.0 star rating","https://www.yelp.com/user_details?userid=vL1KLD373oT-yxzBtQPdwQ","Joe M."
"Dr. Scott Xavier added to our experience and it was mind-blowing and fantastic! The food and the drink was fantastic and in good Supply :-)","3/24/2017","5.0 star rating","https://www.yelp.com/user_details?userid=1LLo-8TGaOz4eFF9fW8JSw","Scott A."
"AaaaaMaaazing!!!!! My mom and I can't stop laughing! We are amped up! What a great time! I'd come back a million times. Highly recommended! A+ food, atmosphere and service!","3/30/2017","5.0 star rating","https://www.yelp.com/user_details?userid=ASKbje5piP9MIf8xrHL02Q","Dani R."
"Food was pretty good and my kids had fun interacting with the staff to solve the clues, but the staff doesn't seem fully comfortable with the theme just yet. Some do and some don't which make its awkward. It's still new so they will get used to it. Know what you are getting into before you go. If you are looking for a 'laid back"" meal with your bros, then don't go. It's more of a good times with friends and family type of place.","3/22/2017","4.0 star rating","https://www.yelp.com/user_details?userid=xM9SBs6bNh4bn9pvMjXkmw","Kip E."
"I brought my friend from Australia to come check out a hot new place I had heard about. The tour guide, Agent Sparrow gave us a great time, introduced us to the magician and gave us the low down without giving away top secret information. ;) will definitely be back.","3/21/2017","5.0 star rating","https://www.yelp.com/user_details?userid=lE9ojFWMVfHOb3nQKUXhBQ","Cameron S."
"This place is amazing. I thought I'd missed it because the entrance is so nondescript. The concept and food are great! Would definitely do it again.","3/21/2017","5.0 star rating","https://www.yelp.com/user_details?userid=2ACdkqvMuyyt9yESg6MKEg","William L."
