"real_review","real_review_date","real_review_rating","real_user_link","real_user_name"
"I LOVED this place.  It was so cool.  Easily the best theme restaurant I've ever been to.....and this is coming from someone who has been to Casa Bonita many, many times since childhood.  For those people who have complained about the theme, saying ""I didn't expect this, was just looking for a quick dinner/drink""......are you freaking kidding me?  This isn't the kind of place you wander into thinking ""oh, this must be a restaurant!""  This is the kind of place you go for an experience, and if you know about it, either you KNOW that it is a themed restaurant/bar or you just didn't bother to read any information WHATSOEVER about the place.  It is on their website, it is on yelp, it is on google.  It's pretty clear what you're getting into.  Anyways, I came here for a yelp event and was extremely excited to check the place out.  They provided nachos, sliders, cheese curds, and drinks.  I don't remember the *clandestine* names they called the drinks, but one was rum based with a pineapple wedge that was DELICIOUS, another was a gin martini.  I wasn't a fan of the gin martini, but that's mostly because I don't particularly like gin.  As for the food, other than the cheese curds, which were passed around by waiters, it was buffet style and average.  However, that is to be expected at a large event.  The cheese curds were phenomenal- I would go back just for those!My fellow agents and I had a really fun time exploring the place, mostly trying to find the password for next time (it is hidden somewhere in the restaurant).  There are a ton of things to explore, but I would not recommend coming when there are a lot of people eating dinner.  It can get a little awkward trying to look at things in the ""spybrary"" when a family of four is just trying to eat dinner.  Service was great, and even though a party of 100 people is probably annoying to serve, they were all gracious and friendly! Overall, this is a great experience and I'm looking forward to coming back to eat off of their full menu and discover some things I probably missed.","3/29/2017","5.0 star rating","https://www.yelp.com/user_details?userid=pEaDXFHgsbJNLLnrzyDWSQ","Ali F."
"I went for a Yelp Elite event last night and I had a BLAST! The staff is so attentive and helpful and they really get into the theme. I was impressed by the unfaltering commitment to the spy theme. Also, the drinks are SO much fun. You have to try as many as you can. My personal fav was the Sterling Archer (Bourbon with lemon juice)!! SO GOOD. I loved doing the scavenger hunt around the restaurant. The decor is SOOO cool! You're like a kid again. Definitely bring a big group of friends and get ready of a night full of fun and adventure with an array of neat cocktails. Also...one of the bartenders is a magician and it's AWESOME.","3/29/2017","5.0 star rating","https://www.yelp.com/user_details?userid=6t3QvtDpBeNcbtDV2yG_Dw","Blaine T."
"We had a great time at the Safe House.  This spy themed restaurant has lots of fun stuff to do and see. Magician Scott Xavier put on a fantastic show of close up and mentalist magic at the bar. There is a fun scavenger hunt too. The food at the Safe House is also delicious and there are some vegan options. Our server ""Agent Scissor hands"" was super friendly and explained the menu and things to do while staying in character. Our food came out really fast too. The provocateur burger is delicious and their cheesy mashed potatoes are amazing. Overall, this is a unique and fun place for dinner and an interactive entertainment experience.  Highly recommend.","3/14/2017","5.0 star rating","https://www.yelp.com/user_details?userid=waN6iwcphiVEoCews4f4CA","Jerry M."
"My friends brought me here and it was one of the most fun and unique experiences I've ever had in the city! The drinks were great, so was the food but the overall atmosphere of this place is fun AF! Without giving too much away, because I don't want to ruin it for noobs but you'll do some crazy shit throughout the night. Honestly, I was drinking too much to engage with the missions, maybe I'll try that out next time when I'm more sober because those are on the very detailed side of town. I just put on my agent badge and started messing with stuff. There's a lot to tinker with if you're into tinkering. LIGHT SPOILER I didn't expect to get a workout at the club! I think the last time I've done anything remotely close to what I did that night when it was time to leave... was when I was 5 years old at a jungle gym! This place is FUN. Would definitely go back!If people don't like this place it's because they are 1) dead inside 2) boring 3) pretentious 4) all of the above.","4/1/2017","5.0 star rating","https://www.yelp.com/user_details?userid=6mSIXjT9y_nqfW4HAG2hcw","Kristal C."
"I was contacted by the manager immediately after my initial visit. He was extremely concerned, empathetic, and professional and invited me back for a proper visit.It was a fun experience overall - getting interviewed spy-style, getting fun ""strike a pose"" photographs upon entering; going down a secret staircase to the dining room. They have the kitschy spy theme down but be informed that this place is more for families or if you're feeling like a kid again.As recommended, I got a burger which was tasty. I like that they have 2 smashed patties versus one really thick one. Fries are thin and really good, but ours arrived luke warm. Mixed drinks are a but weak and little pricey at $14 each. The staff is really nice, especially our server, and they all are committed to the theme except for the hostess.","3/19/2017Updatedreview","4.0 star rating","https://www.yelp.com/user_details?userid=XKvbfNylF6Yq8hpwqaZrhA","Mihir S."
"We're visiting from SoCal and wanted to just hang out at a bar so we came here. Cool and fun concept. I was skeptical at first walking through the first door but then after the 3rd door it was cool. $5 entrance fee.","5/1/2017","5.0 star rating","https://www.yelp.com/user_details?userid=QDJK78RmI7P9q0R8GWNB1w","Lyn D."
"Wasted $20 on an uber coming here thinking it was a normal restaurant. I walked into a tiny room with some creep in a suit. He was an actor of some sort and he wanted me to play some sort of game with him. He said I needed a password and if I didn't have one I could go ""under cover"" as a rabbit in order to get in. No joke. I decided to split since I'm not interested in doing improv with a stranger one on one in some creepy room. This place is obviously some sort of theater experience made for groups having a night out. I just wanted a burger.  Complete waste of my time.","4/13/2017","1.0 star rating","https://www.yelp.com/user_details?userid=ukoxatSEf6ZY9ZoWgNMpwA","Michael D."
"My boyfriend and I actually got really confused as to how to enter this restaurant. We actually thought it had closed, but then we realized it really is 60 E Ontario St. We entered and didn't know the code so we did a couple short dances and were allowed to walk downstairs and enter. The atmosphere is super unique and I think this is definitely a great date spot. They give you puzzles/logic games to solve. It definitely seems like it would also be super fun for kids. They let you walk around and there's different things in the restaurant that you can check out.I got the Fried Chicken Sandwich which was really good, but the fruit is not worth the extra $2. The onion rings are worth the extra $1 though! They have a ""boring"" exit and another exit that costs $1 to exit.Right now, they have a $20 for $10 deal on Yelp, which makes eating here pretty worth it otherwise it definitely can get a bit pricey.","3/12/2017","4.0 star rating","https://www.yelp.com/user_details?userid=JCZXjV7tq9140qNSCdM_Vg","Carol L."
"-----****----- CLASSIFIED INFORMATION BELOW ----****-----SafeHouse is awesomeYour mission, should you choose to accept it, is to walk in and be greeted by a stern receptionist. Don't know the password? Perform a silly task to prove your worthiness to mission control (in my group's case, a conga line). We were granted access, walked downstairs, and were greeted with applause by people who had been watching us on the cameras downstairs.The rest of the night was spent nibbling on surprisingly delicious food, sipping on well-made, fun cocktails, and exploring the space in an attempt to solve all the 'missions' they gave us. This involved finding random, fun spots around SafeHouse and was a ton of fun. Everyone there was really great at sticking to the theme - calling us agents, asking to 'disarm us' (aka clear our drinks), and pretty much every spy lingo you could think of. It was seriously such a fun night - my favorite was the magician at the bar, who I spent about 30 minutes in awe of asking him to perform every trick he knew...I have never been to the Milwaukee location, but I had so much fun here. I would definitely bring some of my others friends back to experience this!!.....should mission control deem them worthy ;)","3/8/2017","4.0 star rating","https://www.yelp.com/user_details?userid=c2QaM6ZUbHD89joFZ9WP0w","Taylor W."
"I visited Chicago with a couple friends and this was rated so highly on Yelp, I forced them to come and it did not disappoint. The attention to detail and the characters are just a few of the things that make this bar a fun experience. I absolutely recommend checking it out!","4/16/2017","5.0 star rating","https://www.yelp.com/user_details?userid=g5MQ2ARIw40nWEd2FOKg3g","Brittany P."
"This is by far my favorite place of the entire trip! There is a spy theme which makes it so much fun! The staff is in character as soon as you walk in the door...there is even a password! For starters they hand you name tags and your friends have to give you a spy name- Agent ??? The bar/restaurant is laid out really cool and you walk right on to the dance floor. There's a DJ spinning really good house and the drink menu is all spy names. My favorite was Spy's Demise which is a rum drink- I love my rum! The bartenders call you by your spy name when you order a drink. The only reason they get 4 stars instead of 5 is because they delivered my nachos to the wrong table so I never got to eat :( but they did comp my drinks. Definitely worth a visit!","3/21/2017","4.0 star rating","https://www.yelp.com/user_details?userid=iL6f31ZKzoFAg9G-x_oPUw","Karina N."
"Went here with our kids on a Sunday evening around 6pm.  We got right in without a wait and had a super fun experience from the minute we walked in until the time we left through the secret exit.  There was a minor snafu with the timing of food being brought out and an issue with one of our entrees, but the manager on duty went out of her way to go above and beyond to make it up to us which was very impressive.  All of the staff that we interacted with played along with the spy theme, which made the place even cooler.  Thanks for making a Sunday night dinner one that our kids will definitely remember and talk about for a long time!","3/19/2017","5.0 star rating","https://www.yelp.com/user_details?userid=HyzoH4KJlfdAGfZfTOmdzA","Cyndee T."
"Fun spot with good food.Not going to spill the beans but it takes some work to find the front door. When you do you need to have a password or do something silly to get in. Fun.Once in, the servers are very friendly.  You can either just hang out or participate in some clue finding games.  Keeps you interested.We got burgers, grilled cheese and a chicken sandwich.  The burgers and chicken were absolutely enormous- really too much food- and the price matched the size.  Very tasty though.One quibble though- $1 to find the secret passage out of the restaurant? Seriously?  FYI there us a $20 for $10 discount in Yelp right now for this place.","3/14/2017","4.0 star rating","https://www.yelp.com/user_details?userid=iz9TTE7Q2OyvICXyQx5Caw","Tony D."
"This bar is an icon of espionage. The milwaukee location is legendary amongst locals! The secret entrance and escape tunnels make it a blast when entertaining from out of town. I'll be back. Try the meatloaf is amazing. My favorite drink is a Tito's martini extra dirty. Shaken not stirred. My favorite magician is Xavier. He makes a great drink and even reads your mind! No really.... All him to do the blindfold routine or twist a fork using magic. It's really cool!","3/15/2017","5.0 star rating","https://www.yelp.com/user_details?userid=tmCnmFOOnzGH3lSwKNhMhg","Scott X."
"Overall our experience at Safehouse Chicago was good. My only complaint was our waiter wasn't in character or enthusiastic like the others.","4/30/2017","4.0 star rating","https://www.yelp.com/user_details?userid=HY_7rVvQRS9IHEyXzleVlw","Phillip C."
"It was a very fun experience. Something different other than the traditional restaurant experience. The food was also amazing I had the MOAB & incognito drink!","4/23/2017","5.0 star rating","https://www.yelp.com/user_details?userid=n_49bBmLF0BE73HoHwJXZQ","Tiara T."
"This place was so much fun for a date night. The French fries were kind of blah but the cheese curds, cheeseburger and spies demise were all awesome! I had a wonderful time and was completely thrown off by the entrance, I thought it was the wrong place at first! I'd definitely go back if I'm ever in Chicago again.","4/23/2017","5.0 star rating","https://www.yelp.com/user_details?userid=mxfyRhs2uKRBJj8WO3nmmg","Melissa F."
"This is the 1st review I've ever written, but our server and this place is more than worthy of a great review. I can't reveal too much, but if you are looking for a great time come here and ask for Diva Davine. She has the proper instructions for you ;) I must say it's a bit pricey tho. We paid $18 for a sandwich, most of the salads are $15, and the burgers $16","4/8/2017","5.0 star rating","https://www.yelp.com/user_details?userid=mHtnfU4KNaPUqI_blCu0rw","Rachael Sana M."
"The 2 stars are for the awesome bartenders and the manager.  This was a very disappointing experience for me.  I've been to the Milwaukee location and was so excited that there was another one close to home.This is a tough review to write because the manager did end up comping our whole group's meal due to our terrible service with the hostesses.  We had a group of 15 (2 ended up leaving after an hour because we waited so long and they had to leave for another event).  The first group of people who got there told the hostess we had 15 people.  She told them that it would be about a 2 hour wait.  So my friend suggested splitting the group up into 2 or 3 tables.  The hostess said it would still be an hour to an hour an a half wait.  There were a bunch of open tables so we didn't understand why it would be such a long wait.  The entire time, the hostess had RBF and was just being nasty in her tone to us.  There was one big table that would have seated us that we saw open for an hour while we waited so we asked the hostess once again why couldn't we be seated there.  She told us it was for a reservation.  On their website it states that they do not take reservations.  After talking to one of the bartenders we found out you can call ahead and tell them to save some tables for you.  We were really annoyed with the way that the hostess was not trying to accomodate the group. My friend ended up going to find a manager to see what he could do. The manager said he'd see what he could do. So we wait another 15-20 minutes (by now we've been waiting for 1.5 hrs) and wonder what is the status of our table.  I go up to the hostess and she tells me that the manager didn't tell her anything and that we never told her what we wanted to do.  I told her the manager told us he'd try to get us seated so she finally goes to talk to her manager.  He comes to talk to us and apologizes for the wait and ends up buying the whole group a round of drinks.  My sister ends up going to the manager later and telling him how rude and not helpful his hostesses were as well as how they laughed (in a bitchy way) at her at one point when she was asking (for the millionth time) about getting a table.  When we finally did get seated, the manager apologized once again and told us our whole groups' meal would be comped.  I appreciated that a lot but it didn't make up for dealing with those hostesses' attitudes.While we were waiting for our table, we got drinks at the bars (there are two) and the bartenders were all so nice and friendly. One of them was actually the one to suggest to us to talk to the manager after we explained to him how we were waiting for so long for a table.As for the food, the cheese curds were amazing. We had onion rings and poutine too which were good.  I had the buttermilk fried chicken sandwich which was tender but lacked flavor.  The whole spy theme was pretty disappointing compared to the Milwaukee location.  There weren't really many ""missions"" to solve.  It was more like, find this or that rather than solving puzzles. I would rather drive to Milwaukee than come back to this location even after getting the meal comped.  The whole experience was a let down.","3/20/2017","2.0 star rating","https://www.yelp.com/user_details?userid=eFDjBULmcp7JixZJLVV9Cg","Kat A."
"This place was not fun. Waiting in line at 9 pm wasn't so bad for a new place in River North, but it was the start of the annoyance. It's​ a theme bar (negative), so it you don't get the password before hand you are shuffled in with a small group and asked to act like an idiot for 10 minutes. The 50s and 60s Cold War espionage theme wears thin immediately as you wait at the bar for some particularly slow pouring of a  spy themed drink or an $8  Budlight. The decor is like if TGI Friday's and Rain Forest Cafe had a love child that only watched the Timothy Dalton ""James Bond"" Movies.You will not be able to find the restroom until it's almost too late. The exit doesn't come fast enough either.","4/4/2017","1.0 star rating","https://www.yelp.com/user_details?userid=OTIC6cCJPDJ1E8_nx5ZnbQ","Ryan R."
"It was a truly fun and interesting experience...of course we didnt know the password so we had to do a little dance wearing a feather boa...make sure to look for the actual address because there is no sign outside (just look for the red door). The wait staff is really nice and attentive...even the manager or assistant manager stopped by to make sure everything was ok...its fun to explore the restaurant a bit and take pictures...they have a fun selfie booth...and a fun way to exit as well...food wise the cheese curds is good as is the mac and cheese...and the chocolate cake is to die for!! definitely recommend it...they give you name tags where your write your ""agent name""...dont throw the sticker out or leave them behind because when you exit, you can stick it in the stair case with the others...","4/27/2017","5.0 star rating","https://www.yelp.com/user_details?userid=9Fltiu7MMOcyG7tfX9i-Bg","Jes N."
"We were vacationing with the whole family and happened across this place on Yelp.  Took a cab and decided to check it out.   So glad we did we all had a great time.  I loved the little magic shows at the bar, the kids loved the scavenger hunt and secret agent name badges.  Our waitress did a good job of playing along with the secret agent/spy theme and the food was very yummy.  I would recommend it to others and would definitely go back again :)","4/13/2017","5.0 star rating","https://www.yelp.com/user_details?userid=z6WYyvrHAmpBSKMWx5bsUA","Angela T."
"A fun place to eat with very friendly wait staff. I ordered the Columbian salad with chicken. Both my drink & food arrived quickly. The salad was average & not much chicken for a $15 salad. It is definitely a place to experience but there are better food options in Chicago. I do plan to visit the original Safehouse in Milwaukee!","4/27/2017","4.0 star rating","https://www.yelp.com/user_details?userid=HWiwHHDiiS5F6Wncz9gj4Q","Jo M."
"I went to SafeHouse Chicago about 6 weeks ago.My friend and I didn't know the password, so we had to do something to silly to get in. Once we got into the bar itself, our friend grabbed her drink and we went to our table.Everyone was in character the whole time. Our waitress was friendly. The food was a little expensive, but the drinks were priced for the neighborhood. There were quite a few vegetarian options. My problem was not with my experience from that day. My card was not charged until about a week ago. How did it take SafeHouse so long to charge me and why do they still have my information to charge me over a month later?!","4/28/2017","2.0 star rating","https://www.yelp.com/user_details?userid=VtCGOOC0HsZMwSluLR-jSA","Jillian H."
"This place SUCK!!!4 guys who just got off workAnd was just looking for somewhereTo enjoy good food and relax.NOT PLAY GAMES !!!!Was ready to spend good money in tips as well just to be able to relax.But after taking a $15 Uber ride, did we get in Hell No.So we took our money and appetite somewhere else.I strongly suggest you not waste your time and going to this place!!!If you're from out of town this is not the place for you.","3/20/2017","1.0 star rating","https://www.yelp.com/user_details?userid=BPSA1IEMwHducLRuWjHCUA","Barry H."
"My mission was simple, enjoy great food and service in a unique atmosphere. Kinda hard to find but, that's part of the fun! Be ready to do something embarrassing if you don't know the password.  The food was much better than I anticipated. I highly recommend the cheese curds. They are fantastic and wonderfully flavored.","4/28/2017","4.0 star rating","https://www.yelp.com/user_details?userid=WBz-yZz2cOSmq8TdAEphyw","Patricia S."
"This place is awesome! I found it thru Yelp and I had surprised my best friend with this place. I was so excited that I spilled the beans about what this place was about according to the reviews. I didn't know the password so I had to do something in order to get in but once I was in I tried to find the password. I got close but I'm not sure if I got it right. The drinks- Typically priced for Chicago. Most of their signature drinks are $14. I got two drinks with two shots of patron and the total was at $57. The one thing I'll say about their drinks is how SWEET they are. It's almost too sweet for me. The atmosphere-Amazing! There's a mission list you can check off and it was fun to take a part of that. You can take  photos in the stealthy selfie section and it was pretty fun. I ended up drinking too much and the bartenders could tell that they gave me water and kept the water going. I ended up puking on my walk to the bathroom that I had to leave. I felt so terrible they actually helped me out and didn't kick me out like most bars would. They helped me and I'm so appreciative of that!","4/2/2017","5.0 star rating","https://www.yelp.com/user_details?userid=kTqBACYZNHks5EtgJcPuHA","Noelle A."
"This is an overpriced tourist trap. After ordering 2 drinks, 1 order of cheese curds, and 1 burger, the bill came out to be $64 before tipping. $64! The burger was good, the cheese curds were average, and the drinks were meh at best. I was slightly hassled by the bartender for wanting blue cheese stuffed olives in my dirty martini, he made a big deal about himself having to make them.My friend and I sat at the back bar which was supposedly the ""magic"" bar, did not witness any of that. Maybe the magician wasn't feeling it while we were there. What we did witness (and heard) over and over was Austin Powers' voice saying ""YEAH BABY!"" Apparently, something was broken in the women's bathroom that connected to that voice, so it would play over and over rather loudly next to the ""magic"" bar.When we finished our drinks and paid the totally reasonably priced bill, we were told by the bartender that we could leave the cool way, which involves paying $1, or we could leave the regular way. We chose the regular way and we will not be returning.","3/13/2017","2.0 star rating","https://www.yelp.com/user_details?userid=EM7zMsaSmYQuKZsf7UCR9w","Catherine C."
"I'm legitimately torn on how to review SafeHouse Chicago.  On the one hand, I want to tell you everything.  But that wouldn't be any fun at all...So here's the deal.Just go.  Play along.  Have a tasty cocktail (like the Sterling Archer).  Wander.  Press buttons.  Open things.  Have the SR-71 sandwich.  Talk to people.  Trust no one.","3/17/2017","5.0 star rating","https://www.yelp.com/user_details?userid=mI70ySvobyD_Rxv4F950bQ","Jeff B."
"This place was like an escape room themed restaurant! It was so cool. It was nice to be entertained will eating lunch. Also, the food was really good and the entire restaurant was themed too. I would definitely recommend this place for sure! We are definitely going back next time we are in Chicago.","4/23/2017","5.0 star rating","https://www.yelp.com/user_details?userid=xfQRZ9OaEO1wWd11XJHBIQ","Ryan N."
