"real_review","real_review_date","real_review_rating","real_user_link","real_user_name"
"The ""Russian"" who let us into the interrogation room was in character the whole time and made the beginning experience a lot of fun. The spy-themed decoration was on point, and even though it was a little awkward at first, it was really fun to loosen up and do silly things with a bunch of strangers. Once we gained access downstairs we were surprised by how big the space was! We settled at the bar in the front and were served by Agent Neptune. He was so attentive and friendly, and we had exceptional service at the bar. He passed us waters even when we didn't ask for them, and made a point to give us new silverware/napkins between food orders. Between the two of us, we ordered 3 drinks, onion rings, mac & cheese and poutine. We spent a little over $100. The drinks weren't the greatest-- but we ordered a bloody mary, an old fashioned... and one off the spy menu... Maybe the other ""spy"" drinks are better? The onion rings weren't anything special either, except that they came stacked on a wire airplane. The mac and cheese was very good, the chicken, broccoli and bacon added great flavor and texture to the macaroni. It was a tiny bit spicy, and I liked the kick to it. The poutine though... it literally took an hour to come out, and by the time it came out, we didn't really want to eat it anymore. More than an hour after waiting at the bar, I asked the hostess how much longer we would have to wait before getting a table-- I said this all non-accusingly! But she responded very rudely, saying we were put as no-shows since they texted us 3 times and we never responded. Turns out they put down the wrong name and phone # so they had been texting the wrong #. But they were still very short with me, saying they would seat us. I went back to the bar and the Poutine had finally come out by that time, so we just decided to finish it quickly and the bar and leave. I went back to tell the hostess we didn't need to be seated, and that they could give it to someone else. And she gave me the biggest fake smile/""ok thanks."" TLDR: Food and drinks are okay. Bartender was awesome. Hostesses sucked.","4/2/2017","3.0 star rating","https://www.yelp.com/user_details?userid=b60waH0oeBCzoZhiVX195g","Bomi K."
"Gave this place another shot and so glad I did.Shoutouts to agents Wonderful and TFunk for making this experience entirely different from my last. Honestly, request TFunk if you come here. Refreshing, unpretentious and attentive- all you could want in a server.This time around, we tried the poutine to start. Holy cheese curds! Fun fact: it's vegetarian. Mushroom gravy, and the perfect amount of cheesecurds shockingly without being heavy. So bomb.I asked Agent Wonderful what his favorite dish on the menu was- burger provocateur. Ordered it and they sure nailed it. Bacon jam. Need I say more?As it was a Friday during lent, my catholic dining partner opted for the fish tacos. Plot twist- they come with fries. My goodness. The aioli with the perfect amount of spice.Now- Im not someone who likes dessert, but when the agents insisted on the fat bastard...who was I to say no? And damn...talk about an ice cream Sunday on crack. The price tag is steep but it's worth every penny. Quantity and quality.","3/18/2017Updatedreview","5.0 star rating","https://www.yelp.com/user_details?userid=onY0SO_5Zl0IjO6R4-SVrQ","Jean L."
"The Safehouse in Milwaukee has been attracting Special Agents on the run for years, but I will focus this review on the Chicago branch of this clandestine organization known only as #Control.Once locating the unmarked entrance (Hint: there is a gas lit flame ensconced by the door), you ingress to a well appointed room manned by an eccentric operative of #Control. He is pleasant, but on guard, and wastes little time before asking you to whisper in his ear, the highly restricted #Password. Knowing the passphrase, as I did, allows immediate access to the lower levels of the structure, through a cleverly concealed #falsewall. Not having access to the appropriate passphrase will cost you time and a small amount of dignity, as you are made to perform simplistic acts of silliness to amuse the weary agent guarding the hidden entrance.Robotic voices confirm that you are passing through bodily scanners as you descend the bunker-like concrete steps to the entrance of the venue. As I passed through the entryway, I was greeted by applause from the patrons, all of whom are watching new entrants upstairs on a concealed closed circuit television. I believe my ovation was due to the fact that I knew the password and was allowed quick access to the underground layer... but it really could have been how good I looked in the tux I had worn from Lyric Opera's stellar presentation of Eugene Onegin earlier that evening. I really don't know. Upon settling into the bar, and acknowledging the compliments of my authentic wardrobe, I ordered a martini (stirred not shaken - sorry, Bond fans) and took in a full view of the place. The decor ranges from super ""techie"" modern to cold war era memorabilia. The constant theme being spy technology and well known historical figures of fact and mostly of fiction. There are authentic pieces from James Bond's Aston Martin, reconstituted control panels of Russian missile silos, and the famed illuminated Mercator map of the Western Hemisphere, where various locations have been red flagged by #Control. The drink list was solid, but then, I'm a martini man and had plenty of options. My date ordered a well balanced libation named for the femme fatale Vesper Lynd, a character in the Ian Fleming novel and 2006 cinematic adaptation, Casino Royale. Interesting fact for #Control: While the Vesper Lynd on your #clandestine menu is not a martini at all, the Vesper Martini was originally conceived by Fleming and became popular in the wake of the 1953 release of the Bond novel Casino Royal. The making of this concoction is what gave rise to the immortal words spoken by the ineffable spy ""shaken, not stirred.""This space will clearly benefit from more bodies than you will find hanging out at midnight on a Wednesday as I did. There is a dance floor (ample, though not huge) and quite a few tables that wind their way around corners and walls adorned with spy memorabilia and artifacts. Screens throughout the venue give real-time video on several sensitive installations. I've mentioned the feed from the ""front-room"" where the operative controls access to #Safehouse. There is also an externally mounted camera that I used to keep tabs on my spy car outside. Lastly, there's a feed from the Milwaukee, where #MsMoneyPenny stands vigilant against enemy operatives infiltrating the alternate secure location.Exfiltrating the venue is a fun experience unto itself. There is a phone booth in the back that can be made to reveal a secret exitway. This trick, however, costs a dollar (cash or credit accepted... of course...). Not only am I not a fan of spending money to leave, we couldn't actually exit because the door to the secret passage was was stuck. The #operative had to give it a swift kick. That said, there are impressive displays as you exit this way, and the passage leads to an ordinary hotel lobby that is not where you entered. That was pretty cool #Control. I look forward to returning with my clandestined cohorts late on a Saturday night to experience the full effect of #Controll's latest underground installment. Just don't tell them the #Password as I'd like to catch a glimpse of their foolery on closed circuit tv over a vodka martini.","3/10/2017","3.0 star rating","https://www.yelp.com/user_details?userid=K61wRZSMuo1dmyJGd5vVAQ","Chuck R."
"I had never been to the Milwaukee location, but I was instantly intrigued when I read the whole concept. I went with 3 other people during lunch time and all of us are in our 30's. With that said I think the place is suited for a younger crowd.Upon arrival it was funny when we didn't know the password so they made us do a hoola dance. Once inside our waiter was really nice, but it was so loud that I didn't really hear him when he was going over the game card thing.While we waited on our appetizer we were able to cross one item off the list. Once the food came though we didn't revisit the list again. lol. We just ate and talked. Now 5 stars for the food. I wasn't expecting the food to be as good as it was. Nachos were excellent! For my entree I went with the mission accomplish Burger and another winner. We finished lunch with bread pudding. Yum! When we left we we're reminded where we were cause we had a hard time getting out and one of the ""Agents"" had to clear us. I think if the place looked more realistic I would have gotten into character more, but how it's set up I would recommend for younger crowd. Make sure to go though cause the food is delicious! :)","3/6/2017","4.0 star rating","https://www.yelp.com/user_details?userid=_vbEQU_xD95RZ-7j93z9hA","Tavi J."
"We went to EscapeHouse on a groupon and due to a scheduling mix up, they gave us a $50 gift card to use here. It was so much fun getting into the place! I'll leave out details so you can enjoy it yourself :)Once inside though, Agent Sparrow took awesome care of us. We put in our order and then explored based on the list they gave us. They weren't clues and such like an escape room, it was more of find this cool part of the restaurant - now find this one. Once we got back to the table, Agent Sparrow gave us a table mission and we finished it in time so we got coupon for the next time we go back :) Now for the foooood. I got the poutine fries and I was really looking forward to the fried egg on top but it was over cooked so it wasn't the runny mess I was expecting. If ordering this, I'd ask the server to make sure that it's cooked to your preference, whatever that may be. Friends got the spy burger, wan lei salad, and the grilled cheese. They each liked their dish! Overall, the service is great, the concept is awesome, and the food is pretty good. That warrants 5 stars in my book :)","3/29/2017","5.0 star rating","https://www.yelp.com/user_details?userid=1nQgh9EsgAF-KpJ-hxIkfQ","Heena D."
"Your mission, if you choose to accept it, is to get to SafeHouse Chicago. ASAP. I have a feeling this is going to become one of the hot new bars in Chicago and I'm really happy I got to go before it starts getting really crowded. The first challenge is to find the bar, since the entrance is unmarked. To find it, keep an eye out for a red door. If you don't know the password to get in, be prepared to take part in a top-secret clearance test to make sure you're not a double agent. Just remember, someone is always watching...Once inside, you encounter an entire spy-themed restaurant/bar. Create your Agent name and you can complete with missions to complete that require you to get out of your seat and explore the incredibly interactive space. If you're sitting down for dinner, you may even have the chance to complete some secret table missions. I didn't realize they actually served food so, unfortunately, my group had already eaten and we regretted it as soon as we flipped through the surprisingly extensive menu. Even though we were full, we still ordered some of the cheese curds because they sounded amazing--and they were. The perfect amount of fried goodness.  Our drinks were good--I had the Espionage and it was deliciously sweet. They even brew their own beer in a collab with Motor Row! This definitely isn't a bar for introverts and, if getting into the theme isn't your thing, then you're going to have a rough time. I strongly suggest making sure you have a couple of hours to eat and explore everything. We didn't know there was so much to do and only allotted 45 minutes before our movie. We didn't have much time to complete any challenges and I'll be planning a return trip soon to complete the full mission!","3/4/2017","5.0 star rating","https://www.yelp.com/user_details?userid=8ul5jONkVI95S367DSj-Vw","Sara G."
"Went on Friday night which was the 2nd day after their grand opening.  It was a little difficult to find the correct entrance, so keep an eye out for the red door.  Luckily my friends are staying at The James Hotel so we just had to walk across the street to get there. You might have to wait in line because it takes a little bit of time for people to go through the ""interrogation process"". I won't say too much about that because you will have to experience that for yourself!!They were not serving food at that time, so next time when I get to try the food I'll update my review.Make sure to explore the place and try out all the best gadgets and puzzles. We wanted to try the photo potholes too but they said it was currently down.Definitely a very fun spy experience! Worth a visit!","3/4/2017","4.0 star rating","https://www.yelp.com/user_details?userid=ORFhyW8oSJbns8BTSOmNzw","Gabriel C."
"Ok I don't want to spoil any surprises but once you find this place and it's little tricky to find what an awesome experience that's all I'll say about that. Once you're inside the whole vibe is a underground secret ops location. They give you a sheet of paper for scavenger hunt that you can do while you wait for your food. I ordered chicken sandwich with bacon, tomato and side of coleslaw. The chicken sandwich and coleslaw was both very good. I forgot the appetizer we got but it was fries wish mushrooms and cheese curds and egg on top. It was AMAZING especially when you let the yolk from the egg leak on to the fries. Highly recommend trying that. The bar area was also cool place. Had magician  there. Exiting from this place also has a neat little surprise for you. Overall I've never experienced anything like this type of bar/restaurant very cool unique and fun place to go. Definitely recommend giving this place a try trust me you won't be disappointed!","3/17/2017","4.0 star rating","https://www.yelp.com/user_details?userid=n0YUqMs6zCWpQ9TjIskOjg","Jesse M."
"Spy-themed kitsch at its best! This family-friendly honey trap below Ontario Street is worth the brush pass, especially for its stellar appetizers and stealthy entrees. But the higher-than-average Chicago price points might leave some double agents feeling burned.Upon entering the covert facility through its subtle red door at #60 E. Ontario - simply labeled ""International Exports Limited""- you step into what looks like an office waiting room where you are immediately greeted by a Miss Moneypenny-like receptionist, complete with a thick Russian accent. I won't spoil the fun - just remember to have your password ready, and that ""Control Is Watching"". After passing the ""double agent test"", you weave your way downstairs through the winding staircase, eventually popping out at the Control Booth (hostess stand), where you're greeted with a loud ""Welcome Agents!"" scream that might scare ""The Living Daylights"" out of you - but not to worry, you'll eventually get used to hearing the ""Welcome To Moe's""-like greeting every few minutes.Unlike their Milwaukee site, the Chicago craft cocktail menu leans towards sweet bourbon drinks, with their ""covert concoctions"" a full $2 and $3 more than the same drinks served back in Wisconsin. The Agent Chi ($14) is a super-sweet blend of Koval Bourbon and lemon lime soda with a syringe of raspberry Frambois you're suppose to shoot into the small, eight-ounce glass. The Sterling Archer is a perfect blend of vodka, pear schnapps, lemon juice and Jamaican Bitters, but, again, woefully overpriced at $14. Ditto for the copper-mugged Moscow Mule made with chintzy Tito's Vodka, ginger puree and fizzy soda.While there are no hunky henchmen and scantily clad Bond girls wandering around to distract diners from the constantly flashing and beeping interior, the food offerings caught everyone's attention at our table. We started with the C-4 Cheese Curds ($10), perfectly browned Wisconsin mild white cheddar nuggets, hand dipped and fried to order. The Blacklisted Chicken Tenders ($14), which were highly recommended by our waitress/bartender tag team, are also a secret standout - sautéed tenders with a stealthy, sneak-up-and-garrote-your-throat heat, cooled by a classic New Orleans-style remoulade dipping sauce.On to the entrees, the Day Smart Turned Chicken ($12) is a marinated chicken breast with smoky bacon, cheddar cheese, lettuce and sliced 'mater on a perfectly warmed bun. The SR-71 Black Bird chicken sandwich ($15) was the high-flying hit of the evening - undoubtedly the juiciest ""Goldeneye""-fried chicken breast I've put my ""Jaws"" around since leaving North Carolina - and that includes the sandwich and biscuit offerings from Do-Rite Donuts, and The Roost. The Cuban Missile Crisis ($15) was billed as a smoked pork sandwich, a'la a classic Cuban, but it lacked a healthy crust on the mildly panini-pressed exterior. The Tradecraft Fish Tacos looked pretty decent as well - three fried cod strips topped with coleslaw and chipotle ranch dressings, but XOCO-pricey at $16.Sadly, the side dishes were as disappointing as some past Bond villains - the limp and soggy French fries were as pale as Zoa from ""Die Another Day"", and the small shooter of sweet coleslaw was as under-portioned as Nick Nack from ""The Man With The Golden Gun"". Splurge on the $1 up charge for the onion rings, 'cause ""You Only Live Twice""!Departing the underground facilities can be a challenge itself - just remember to have a spare, crisp $1 bill handy if you opt to exit through the stainless steel bank vault door. I mistakenly swiped my credit card in the phone booth to pay my one-dollar exit fee, only to have my bank shut down my account. (Gee, thanks!) Overall, a great dining experience for families and those gaggles of tourists in town for the weekday convention - the food was certainly better than average and the service was absolutely top notch. Unfortunately, the price points will keep the local neighbors like us away - but, to quote the Bond film knock-off, ""Never Say Never"".","3/12/2017","4.0 star rating","https://www.yelp.com/user_details?userid=vz4eJpx3VpIoqC0VobaRDA","Jamie M."
"Love the concept & what you have to do to get in.  The food is large & tasty.  Most portions are pretty big except for salmon & tacos.The drinks are strong & you will have a ball trying to complete the missions","4/19/2017","4.0 star rating","https://www.yelp.com/user_details?userid=zX8cJhp70EXCEJ05H1GZCA","Tiffany M."
"Safehouse is a really cool and different place to go to in Chicago! I would definitely take someone who's out of the state here just because it's not your typical restaurant.   My friends and I got here around 7pm on a Saturday and there was an hour and 15 minute wait! However we were able to grab a booth by the hour to drink and eat, it's just away from the main seating area though. It was crazy busy and so loud, we had to shout to talk to each other but we didn't mind that.   I got the tradecraft tacos, which were really good! I wish they had different choices instead of only fish though. The sauce they use was yummy, and they're a good size so you'll be full afterwards.   The problem we had were with the drinks and service. I got the spy see, and I enjoyed the name of the drink but not the drink itself. It basically tasted like water and it was not remotely spicy. My friend got the spy's demise, which she said was more or less pineapple juice. It took forever to get the bill, so just beware of that when it's busy!","4/9/2017","3.0 star rating","https://www.yelp.com/user_details?userid=PHbTQM0IG_VSIGpUwDMzXA","Jamie J."
"I was just here last night with some friends.They have got this spy theme down pat.It's rather unique from Chicago.It's like ""get smart"" came back not as a TV show but as a restaurant/bar/club lounge.The food I had and my friends had was outstanding. We had some cheese curds which oozed with deliciousness.Then I had their version of fish and chips which is good and presents itself as a hearty meal.One of my friends ordered the salmon entree. She allowed me to taste it. I recommend it. It was very tasty, it contained the right amount of bbq sauce.  I have cooked salmon many times and I prefer to be medium or medium rare but im always off on the timing. But the chef who made this was right on the money. I highly reccomend that and the nachos. .Dessert as opposed to desert/ Those are 2 different things. The dessert was awesome. We had the brownie cheesecake. it had chocolate sauce on the side. My diet restarts tomorrow any time i am confronted by brownies and cheesecake so you can imagine that they have saved me some time by combining it.I am going to come back to see what the dance floor is all about.","2/21/2017","5.0 star rating","https://www.yelp.com/user_details?userid=KzeuiNuCD08XJDU2e1CbEg","Sam N."
"What a find!!! Here's a hint for you...the red door!! You will not be sorry. Great food and a great experience is awaiting your arrival. Get going spies!!!","4/25/2017","5.0 star rating","https://www.yelp.com/user_details?userid=mcLrVGlNKO6NUbXhbIHtFQ","Lacey H."
"I'm not going to say anything about getting in this place...that's up to you.  Very fun, though.  All in all, theme restaurants aren't my bag, but this one is different and very fun.  I came with kids, in fact, we had a party of nine.  I imagine this would be a totally different experience out with adults for drinks, though, would be fun to try!Food-wise, I would say it's 3 stars.  It was all good, but none of it was memorable.  Around our table, I sampled: meatloaf, a reuben, mac & cheese, a burger, nachos, wings, and cheese curds.  The only thing that really stood out was the cheese curds.Service-wise & fun-wise, this place is a 5.  Outstanding service, although one of our burgers came out 3 minutes later than the rest.  The theme was perfect and very well-done.  I doubt I'll go back, but for a one-time thing: YES!  By the way, the magician/bar-tender Xavier was the highlight, for sure!","4/5/2017","4.0 star rating","https://www.yelp.com/user_details?userid=NHak4_gzkWVIYNzDJ-wCWA","Steven P."
"An interesting concept but I can't say it's my style.  This is definitely an interesting activity/interactive experience and I thought it was well executed but it was just not the type of place I enjoyed.  I felt like the place is more designed for families and kids than adults which seems to be the demographic they are trying to target.","4/26/2017","3.0 star rating","https://www.yelp.com/user_details?userid=kSzqm7et15wJjrKnJDT0Ig","Eric Y."
"Overall: cool/unique place for a family or tourist looking for a different experience in Chicago.Came here for a Yelp event and initially loved the concept - secret bar, unmarked, spy-themed - I thought there was no way I couldn't love this place. Unfortunately, it fell a little flat for me on the atmosphere. Seemed a bit more novelty and (for lack of better terms) gimmicky for a spy-themed restaurant/bar.I will say though, the food was great and I really appreciated the theatrics when entering as well as the servers/bartenders staying in 'character' addressing guests as spies and agents. If I were a kid, this place would be heaven.The back bar has a very strange set up, it's really small in the center where the serving area is but the outer parts extend for inside and outside seating which kind of cuts off the flow of service for the bartenders.","3/30/2017","3.0 star rating","https://www.yelp.com/user_details?userid=RmZftN5LBMlobgKISfoVjw","Ryanne A."
"A few things to note:1) Know what to expect - that this is a themed restaurant. The first time I came with my boyfriend, looking for a quick meal on our way home after a day of work. SafeHouse had good reviews online due to being new and was nearby - so we stopped here. Little did we know that our ""quick dinner"" was actually a spy-themed restaurant. We opened the door and were greeted by a gruff-sounding man in character, but we thought we'd accidentally walked into someone's office and felt bad. Once I realized what was going on, I played along - but my boyfriend was not amused. I came again tonight and there was a teenager in the group I was ushered in with who was also not amused and refused to play along with the gimmick. So like I said, know what to expect. 2) Food is okay - pretty good but nothing to write home about. I feel like you would go to this restaurant more for the spy experience if you're into that kind of thing. It's not cheap (although it's in a touristy area, so that's not surprising) - pretty standard American food (burgers, salads, mac n cheese, etc) but with a spy theme. 3) As some other reviewers have mentioned, you had to pay $1 to leave. I honestly wasn't sure if it was a gimmick or not because I find the concept of having to pay to leave so ridiculous, whether or not it's a ""cool"" route. But I just wanted to get out of there and get home - so I swiped. Lo and behold, the phone did NOT ring (as it supposedly would if I swiped my credit card). I stood there debating whether I was supposed to swipe/pay again before someone else came and told me there was another more normal exit. I'm super annoyed that I was forced to pay to try to leave via a way that didn't even work, and that alone makes me take a star off from 3 stars to 2. It's left a bad taste in my mouth (no pun intended, being on Yelp) and turns me off to coming back, to be honest.","3/28/2017","2.0 star rating","https://www.yelp.com/user_details?userid=Z6UZvxZDgDsFn-f54QDzpQ","Susan L."
